{
  "openir_version": "1.0",
  "id": "projector-acme-cinema-100",
  "category": "projector",
  "brand": {
    "id": "acme",
    "display_name": "ACME",
    "aliases": [],
    "manufacturer": "ACME Example Devices",
    "website": null
  },
  "model": "Cinema 100",
  "aliases": ["C100"],
  "description": "Exemplo fictício de projetor com protocolo NEC e quadro especial de repetição.",
  "year": 2025,
  "region": ["global"],
  "manufacturer": "ACME Example Devices",
  "capabilities": [
    {
      "id": "power_on",
      "display_name": "Ligar",
      "description": "Liga o projetor.",
      "aliases": ["Power On", "ON"],
      "value_type": "trigger",
      "unit": null,
      "allowed_values": null,
      "range": null
    },
    {
      "id": "input",
      "display_name": "Entrada",
      "description": "Avança para a próxima entrada.",
      "aliases": ["Source", "Input"],
      "value_type": "trigger",
      "unit": null,
      "allowed_values": null,
      "range": null
    }
  ],
  "commands": [
    {
      "id": "command-power-on",
      "display_name": "Ligar",
      "canonical_name": "power_on",
      "aliases": ["ON"],
      "encoding_type": "protocol",
      "protocol": {
        "id": "nec",
        "display_name": "NEC",
        "variant": "standard",
        "state_model": "stateless",
        "parameters": {"address": "0x10EF", "command": "0x01", "bits": 32},
        "documentation": null
      },
      "raw_data": null,
      "parsed_data": {
        "representation": "command",
        "data": {"function": "power_on"},
        "base_state": null
      },
      "repeat": {"count": 1, "mode": "protocol_repeat_frame", "gap": 108000},
      "frequency": 38000,
      "notes": "Alguns projetores exigem confirmação; este exemplo demonstra repetição protocolar."
    },
    {
      "id": "command-input",
      "display_name": "Próxima entrada",
      "canonical_name": "input",
      "aliases": ["Source"],
      "encoding_type": "protocol",
      "protocol": {
        "id": "nec",
        "display_name": "NEC",
        "variant": "standard",
        "state_model": "stateless",
        "parameters": {"address": "0x10EF", "command": "0x09", "bits": 32},
        "documentation": null
      },
      "raw_data": null,
      "parsed_data": {
        "representation": "command",
        "data": {"function": "input_next"},
        "base_state": null
      },
      "repeat": {"count": 0, "mode": "none", "gap": 0},
      "frequency": 38000,
      "notes": null
    }
  ],
  "compatibility": [
    {
      "device_id": "projector-acme-cinema-110",
      "level": "family",
      "scope": ["power_on", "input"],
      "confidence": 0.35,
      "evidence": "derived",
      "notes": "Relação fictícia usada para demonstrar compatibilidade de família.",
      "tested_at": null
    }
  ],
  "contributors": [
    {
      "id": "openir-example-team",
      "display_name": "OpenIR Example Team",
      "roles": ["author"],
      "url": "https://openir.dev/"
    }
  ],
  "source": {
    "origin": "generated",
    "references": [
      {
        "uri": "https://openir.dev/examples/projector",
        "description": "Dados fictícios para validação do schema.",
        "hash": null
      }
    ],
    "captured_at": null,
    "confidence": 0.15
  },
  "license": {
    "spdx_id": "CC0-1.0",
    "name": "Creative Commons Zero v1.0 Universal",
    "url": "https://creativecommons.org/publicdomain/zero/1.0/"
  },
  "status": "draft",
  "version": "1.0.0",
  "supersedes": null,
  "extensions": {}
}
